id|url|name|price|currency|rate|description|instruction|made
83670100008|https://goldapple.ru/83670100008-natural-elegance|STATE OF MIND Natural Elegance|15925|RUB|5.0|Современный шипровый аромат Natural Elegance с красивым и ярко выраженным шлейфом отражает баланс между простотой и изяществом элегантной женщины, её внутреннее сияние. Она знает, что истинная красота – не в платьях или причёске, а в глазах и сердце. В одновременно лёгкой и многогранной композиции гармонируют ноты зелёного чая Юньнань, османтуса, выразительного и сочного абрикоса. Лёгкий оттенок пачули в аромате подкреплён амброксаном.   **Верхние ноты: зеленый чай Юньнань, абрикос  **Ноты сердца: амброксан, жасмин, османтус **Базовые ноты: пачули, дубовый мох **||страна происхождения: Франция; изготовитель:ALEGRIA SAS, 36, rue des Fontaines, 92310 Sèvres, Франция;
19000122337|https://goldapple.ru/19000122337-angel-s-name|HELLO KITTY ANGEL’S NAME|403|RUB|5.0|Туалетная вода Hello Kittty - это ода нежной и радостной юности, которую парфюмеры, будто особенные волшебники, поместили во флакон. Некоторые могут обмануться названием данного аромата и посчитать, что его создали для совсем юной аудитории, но это не совсем так... Мы уверены- многие молодые девушки захотят ощутить, как это быть частью волшебного мира Hello Kitty, как верить в добрые сказки.**Ноты: арбуз, киви, ревень, цикламен, лимонное дерево, розовый перец, жасмин сандал. Волшебный, фруктовый и свежий аромат, сладкий, но не приторный. Услышав, вы никогда не забудете его - он прекрасен, как имя ангела.|Парфюм всех типов наносится на чистую, слегка увлаженную кожу.|страна происхождения: Россия;
19000168008|https://goldapple.ru/19000168008-blizost|ОБЫКНОВЕННОЕ ЧУДО Близость|2700|RUB|0.0|Аромат «БЛИЗОСТИ» - очень уютный и интимный, ненавязчиво окружает вас легким фруктовым покрывалом. Содержит ноты бергамота, ирги, инжира, личи, фрезии, коры дуба, белого кедра.||страна происхождения: Россия; изготовитель:ИП Троянова Юлия Николаевна ; Продавец; ИП Троянова Юлия Николаевна; ОГРН / ОГРНИП; 322246800089317; Юридический адрес; Красноярский край, г Красноярск, ул Монастырская, д. 34;
19000178408|https://goldapple.ru/19000178408-sea-storm|YNEPSIE SEA STORM|2700|RUB|3.4|"""Подобно морскому шторму, этот контрастный и сбалансированный аромат Ynepsie стартует с яркого, сильного дуновения свежести. Насыщенные морские ноты и искрящийся калабрийский бергамот переносят к далеким берегам, где прохладные волны омывают теплый песок. Контраст усиливают теплые базовые ноты сандала, амбры и пачулей, которые создают идеальный баланс с ароматическим сердцем композиции. *"|Только для наружного применения.|"страна происхождения: Франция; изготовитель:""PARFUMS CORANIA"", мекенжай: ZA L'Agavon, 9 Avenue Lamartine 13170 LES PENNES MIRABEAU, Франция;"
19000258592|https://goldapple.ru/19000258592-scandal-le-parfum|JEAN PAUL GAULTIER SCANDAL LE PARFUM|8560|RUB|5.0|Насыщенная женская парфюмерная вода в скандальном стиле Jean Paul Gaultier**Забудьте об условностях cо SCANDAL LE PARFUM! Какая разница, если это кого-то шокирует? Ослепительный взрыв жасмина в верхних нотах будоражит чувства. Пленительная солёная карамель сбивает с толку – какая наглость! Опьяняющая черная ваниль раскрывается древесно-кожаными аккордами. *Цветочно-амбровая композиция так возмутительно привлекательна, как кокетливые ножки, что красуются на ярко-красном флаконе.**SCANDAL LE PARFUM великолепно раскрывается на запястьях, потрясающе – на шее, умопомрачительно – в зоне декольте. Чего же вы ждете?**Парфюмеры: Фабрис Пеллегрен, Дафна Бюже, Ане Айо.|Нанести на кожу, избегая попадания в глаза.*Для более полного раскрытия аромата рекомендуется нанести его на точки пульса на шее, зоне декольте и запястьях.|страна происхождения: Франция; изготовитель:Пуч Франс САС (Puig France SAS), 65/67, Avenue des Champs Elysees, 75008, Paris, France, Франция;
26774300002|https://goldapple.ru/26774300002-sicily|MANCERA SICILY|14080|RUB|5.0|Яркий искрящийся грейпфрут, мандарин и бергамот из Сицилии превосходно сочетается с сочным зелёным яблоком, нежным белым персиком и лакомым ананасом. Чувственный жасмин и роскошная роза дополняют букет молочного иланг-иланга и акватической фиалки в плавно переходящее звучание майсурского сандала, величественного кедра и нежное прикосновение белого мускуса.||страна происхождения: Франция;
28330100001|https://goldapple.ru/28330100001-no-9-bukhoor|THOMAS KOSMALA № 9 Bukhoor|15645|RUB|3.7|Бахур – это арабское название ароматов для дома, которые воскуривают из древесных щепок, пропитанных эфирными маслами. Парфюмерная композиция THOMAS KOSMALA – словно бахур, дымящийся на тлеющих углях и наполняющий дом благоуханием дымно-древесных аккордов с теплым дыханием амбры и мускуса. Подобный аромат используют для особых случаев, а также для расслабления, медитации или заряда положительной энергии.  *||"изготовитель:""Extravaganza General Trading LLC"", адрес: P3 The Box Storage, Dubai Investment Park 1, Dubai, Объединенные Арабские Эмираты.;"
80111800003|https://goldapple.ru/80111800003-euphoria|CALVIN KLEIN Euphoria|6594|RUB|4.9|Аромат Euphoria для женщин - таинственный и привлекательный, как темные экзотические цветы. Этот роскошный, восточно-цветочный парфюм вышел в свет в 2005 году. Парфюмерная вода Calvin Klein Euphoria приглашает женщин насладиться радостями жизни. Очаровательный и яркий шлейф аромата Euphoria Calvin Klein создает вокруг своей обладательницы ауру соблазна, флирта и призыва. Основные ноты: гранат, лотос, орхидея, фиалка, амбра, мускус и махагони. Характеристика: согревающий, экзотический, волнующий, манящий, чувственный, решительный, соблазнительный. Подходит для вечернего использования в холодное время года.|Только для наружного применения.|страна происхождения: Испания; изготовитель:«COTY SPAIN, S.L.», ИСПАНИЯ, C/de la Marina 16-18, Torre Mapfre, Planta 16, 08005 Barcelona, Spain;
19000011921|https://goldapple.ru/19000011921-aura-spa-exotic|LA RIC Aura Spa Exotic|7480|RUB|0.0|"Интерьерный аромат """"Экзотика"""" от La Ric подарит Вашему дому атмосферу гармонии, благополучия и романтики. Входящие в состав аромата """"Экзотика"""" маракуйя, ананас и абрикос улучшат настроение и наполнят Вас жизненной энергией. *Теплый, знойный, фруктовый аромат экзотических странствий.*"|Поместите тростниковые палочки в флакон. Когда вы захотите добавить интенсивность аромата в помещении – переверните палочки. Если вы хотите слегка обновить аромат – переверните 2-3 палочки. Повяжите ленточку La Ric вокруг бутылки.|страна происхождения: Австрия;
7682200006|https://goldapple.ru/7682200006-ange-ou-demon|GIVENCHY  ANGE OU DEMON|12320|RUB|5.0|Женская парфюмерная вода Ange ou Demon от Givenchy - роскошный, яркий восточный цветочный аромат. Нежные ноты Мандарина и Лилии изысканно дополняются чувственным трио Шафрана, абсолюта Дуба и Палисандра. Аромат представляет собой настоящую ДНК Givenchy – французский стиль, элегантный шик, игривую спонтанность и истинно аристократическую душу. Аристократичный флакон аромата вдохновлен элементами дизайна внутреннего убранства в Доме Высокой моды Givenchy и имеет форму роскошной подвески.**Дополните ваш чувственный образ роскошной помадой для губ Le Rouge с сатиново-матовым эффектом или Le Rouge Deep Velvet с матовым эффектом с ухаживающими компонентами в составе.||страна происхождения: Франция; изготовитель:«LVMH Fragrance Brands», адрес:  77 Rue A. France, 92300 Levallois-Perret, Франция;
19000173785|https://goldapple.ru/19000173785-une-flanerie-sous-l-oratoire|ROSE ET MARIUS Une flânerie sous l’oratoire|2678|RUB|5.0|Прикоснитесь к искусству жизни на Юге Франции с уникальными композициями из Грасса. Парфюмерная вода Une flânerie sous l’oratoire заключает в себе двойной смысл, таинство и дань уважения. *С одной стороны, это приглашение на прогулку рядом с одной из старейших часовен в Экс-ан-Провансе, которая возвышается над входом в фирменный бутик бренда. С другой — истоки парфюмерии (от латинского per fumum «через дым»), когда в древние времена греки и египтяне сжигали благовония для общения с богами. *Для этой смелой и элегантной композиции создатели использовали сомалийский ладан, извлеченный из священных деревьев. Темное и насыщенное начало деликатно дополняется цветочными нотами абсолюта мимозы. *Палисандр, ноты перца и белого мускуса дарят чувственность и изысканность. *|Распылите на кожу на расстоянии 20-30 см.|"страна происхождения: Франция; изготовитель:""ROSE ET MARIUS"", адрес: Petit Cap, 41 A chemin du Rivage F-13620 CARRY LE ROUET, Франция.;"
83290100011|https://goldapple.ru/83290100011-neroli-a-la-cardamome-du-guatemala|CHOPARD Neroli a la Cardamome du Guatemala|13575|RUB|4.7|Красивый чарующий аромат переплетается свежими нотами гватемальского кардамона и белыми чистыми цветочными оттенками нероли, завораживает французским шармом и переносит в праздничную атмосферу каннского фестиваля.**Аромат открывается свежими цитрусовыми нотами солнечного мандарина и древесно-аммориллисовым дымным запахом эфирного масла нероли (цветов горького апельсина), которые деликатно смешаны в сердце композиции с сочными, сладкими оттенками апельсина и горьковато-пряным аккордом гватемальского кардамона. Эфирное масло амбретты (семян гибискуса) насыщает шлейфовые ноты, придавая  парфюму чувственный мускусный запах,  гармонично оттененный бальзамически-терпкими аккордами светлой древесины.*|Только для наружного применения.|"страна происхождения: Италия; изготовитель:""PFCH LUXE SA"", адрес: Rue du Parc 3 BIS, 1207, Geneva, Швейцария;"
19000196204|https://goldapple.ru/19000196204-peonia|WALLY 1925 Peonia|6240|RUB|0.0|Пион – благородный и нежный цветок, наполняющий элегантным и утонченным ароматом любое помещение. В вашем доме воцарится гармония и порядок. Большой популярностью этот аромат пользуется и в коммерческих помещениях.|Рефилл, или наполнитель – это парфюмерная эссенция любимого аромата, разлитая в пластиковый флакон. Рекомендуем поддерживать уровень эссенции во флаконе не менее 2/3 объема, что в свою очередь обеспечивает интенсивность и эстетическое восприятие аромата.|страна происхождения: Италия; изготовитель:L.C.P.L.A. s.r.l., Via della Robbia 21, 59013 Montemurlo-PO;
19000154002|https://goldapple.ru/19000154002-dragon-flower|TESORI D’ORIENTE Dragon flower|786|RUB|4.3|Туалетная вода Tesori d'Oriente Цветок Дракона принадлежит к группе восточных ароматов. Ночная прогулка в азиатских садах, где красота и природа всегда находятся в идеальной гармонии, очарует вас чарующим ароматом цветка дракона. Таинственный и провокационный аромат, рожденный слиянием четырех граней: аккорда миндаля, драгоценного богатства жасмина, чувственного мускуса и сандалового дерева, гипнотического очарования ванили и амбры.**Tesori d’Oriente Туалетная вода 100 мл приглашает Вас окунуться в мир эстетики и великолепия. Уникальная разработка итальянских парфюмеров создает туалетную воду с ярким ароматом, обладающим хорошей стойкостью до 10 часов. Туалетная вода Tesori d'Oriente принадлежит к группе восточных ароматов. Ольфакторное путешествие унесет вас от повседневной жизни: бегство в живописные уголки мира, окруженные бирюзовыми водами, где вы сможете найти свой внутренний покой. Ароматы, произведенные в Италии, созданы на основе натуральных масел, с натуральными компонентами. *Продукция вдохновлена древней идеей превратить ежедневный уход за телом в красивый ритуал, с помощью которого можно гармонизировать тело и душу. Парфюмерия данного бренда содержит традиционные восточные компоненты, использующиеся в течение многих веков при изготовлении косметики. Ароматические композиции разработаны ведущими мировыми парфюмерными компаниями и подойдут для подарка самым близким людям, потому что привлекательная и удобная упаковка имеет премиальный вид. Насладитесь роскошью гармонии Востока!*|Нанести на тело или одежду, избегая попадания в глаза или на раздраженную кожу.  При необходимости повторить нанесение в течение дня.|страна происхождения: Италия; изготовитель:CONTER S.R.L.- Viale Europa, 12- 26855 Lodi Vecchio (LO), Италия;
19760342310|https://goldapple.ru/19760342310-mixed-emotions|BYREDO Mixed Emotions|26300|RUB|5.0|В композиции расслабляющие оттенки мате и пикантная сладость черной смородины обрамлены древесными нотами; успокаивающему аромату черного чая придает волнующее звучание лист фиалки. Это освежающее напоминание о том, что любая человеческая эмоция - это нормально, и что даже тревожные переживания могут стать новым началом, точкой роста, из которой может появиться новая позитивная реальность.*||страна происхождения: Франция; изготовитель:BYREDO FRANCE SAS;
82510400003|https://goldapple.ru/82510400003-the-nuptial-bouquet|ATKINSONS The Nuptial Bouquet|12937|RUB|5.0|Аромат ATKINSONS – это нежное сочетание цветов, характерных для королевских свадебных букетов. При английском дворе неотъемлемой частью букета невесты считается мирт – символ верности и брака. Эту романтичную традицию ввела королева Виктория. Ее история любви с принцем Альбертом стала вдохновением при создании аромата. Парфюмерная композиция возвращает в то время, когда язык цветов мог говорить о многом. В современной версии свадебного букета королевы Виктории собраны очаровательные ландыши, фиалки и, конечно, изысканный мирт. Сандал и нежный мускус дополняют аромат для женщин, которые достойны принца и не согласны на меньшее. *||страна происхождения: Италия; изготовитель:«EUROITALIA S.R.L», адрес: Via Galileo Galilei 5, 20873 Cavenago di Brianza (MB), Италия;
19760322098|https://goldapple.ru/19760322098-bitter-peach|TOM FORD Bitter Peach|38350|RUB|5.0|«Откровенно сладкий, темный и роскошный аромат Bitter Peach накрывает волной таинственной, обволакивающей чувственности. Он напоминает спелый и сочный фрукт, перед соблазнительным ароматом которого невозможно устоять», — ТОМ ФОРД.*Tom Ford представляет новый аромат в коллекции Private Blend. Bitter Peach — это роскошный соблазнительный нектар из самых спелых, головокружительно сладких фруктов с манящим ароматом.*Опьяняющая фруктово-цветочная композиция открывается аппетитными сладкими нотами персика, выросшего среди виноградников, и масла красного сицилийского апельсина. Острота пряного масла кардамона как будто вызывает ощущение сочной и спелой мякоти на языке.*В чувственном сердце аромата горькие ноты гелиотропа и масла полыни переплетаются с головокружительными оттенками абсолюта рома и коньячного масла. Звучание абсолюта арабского жасмина подталкивает к беззастенчивому изучению своих желаний.*Роскошное сочетание абсолюта сандалового дерева, бензоиновой смолы и кашмерана делают шлейф более насыщенным и выразительным. С нотами ванили, абсолюта бобов тонка и масла индонезийского пачули Bitter Peach не теряет своей соблазнительности.  *Изысканный дизайн флаконов Tom Ford Bitter Peach продуман до мельчайших деталей. Изнутри флакон объемом 50 мл покрыт перламутровым лаком, а снаружи выполнен из полупрозрачного стекла нежного оттенка. Флакон подчеркивает насыщенность и многогранность композиции и манит прикоснуться к миру сладких и соблазнительных ароматов. Оттенок флакона навеян разнообразными оттенками мякоти персика и винтажными цветными стеклами.||"страна происхождения: США; изготовитель:""Estee Lauder B.V."" / ""Эсте Лаудер Б.В."", БЕЛЬГИЯ, Nijverheidsstraat 15, B-2260 Oevel-Westerlo/ Нижверхестраат 15, B-2260 Увел-Вестерло;"
