id|url|name|price|currency|rate|description|instruction|made
19000206584|https://goldapple.ru/19000206584-black-weed|BIRKHOLZ Black Weed|10543|RUB|4.5|Расслабляющий и окутывающий теплом аромат BIRKHOLZ отражает великолепную природу скандинавской зимы. *Древесно-бальзамический аккорд и мягкие пряные ноты шафрана, мускатного ореха и корицы передают атмосферу зимней поездки в загородный деревянный домик, где в тишине потрескивает камин и витает согревающий аромат горячего шоколада с оттенком ванили. **|Только для наружного применения.|"страна происхождения: Германия; изготовитель:""BIRKHOLZ International GmbH"", мекенжай: Albert-Einstein-Ring 46, 14532 Kleinmachnow, Германия.;"
26421400015|https://goldapple.ru/26421400015-fico-di-amalfi|ACQUA DI PARMA FICO DI AMALFI|7990|RUB|4.9|Берег Амальфи. Удивительный захватывающий сценарий, словно аромат Fico di Amalfi, с глубоким тонизирующим эффектом. Яркое начало с оттенками бергамота, лимона, грейпфрута и цитрона. Нектар инжира, розовый перец и лепестки жасмина переливаются в сердце аромата. Шлейфовые оттенки раскрываются  изысканным, гармоничным сочетанием инжирного дерева, кедра и бензоиновых смол.||страна происхождения: Италия; изготовитель:“Acqua di Parma S.R.L.”, Италия, 99 Via Giuseppe Ripamonti, 20141 Milan, Italy;
19000163469|https://goldapple.ru/19000163469-bendito-beso|BESO BEACH Bendito beso|9386|RUB|4.4|Свежий и соленый бриз, вечнозеленые дикие деревья, отблески солнца на воде, следы на песке, загорелая кожа — во флаконе BENDITO BESO. Расслабленный и жизнерадостный аромат, вдохновленный каникулами на острове Форментера в Средиземном море. *При первом вдохе появляется бергамот, который исчезает, чтобы раскрыть жасмин в сердце композиции. *В базе остаются кедр и элегантный мускус.*|Распылите на кожу с расстояния 20-30 см.|"страна происхождения: Испания; изготовитель:""LANDING BARCELONA SL"", адрес: CL DIPUTACIÓ, 266 LOCAL 2, 08007 BARCELONA, Испания;"
19000127341|https://goldapple.ru/19000127341-04-the-noir-fume-armoise-bouleau|BON PARFUMEUR PARIS! 04 – thé noir fumé, armoise, bouleau|1450|RUB|0.0|Ароматическая свеча BON PARFUMEUR из натурального растительного воска создает атмосферу уюта и наполняет помещение изысканным ароматом. Ключевые ноты гипнотической парфюмерной композиции – черный чай, полынь, береза. Завораживающий аромат впечатляет тонким дымным аккордом чая «лапсанг сушонг», которому полынь придает неожиданную и приятную свежесть. Древесная нота березы добавляет аромату глубины благодаря своим характерным теплым, сладким и кожаным граням. *Композиция окутывает уютом и переносит в момент чаепития у камина в прохладный осенний день. *|При первом использовании свечи зажгите ее на 1–2 часа, чтобы воск равномерно расплавился до краев стекла. Держите свечу вдали от сквозняков. Немного обрезайте фитиль перед каждым использованием. Перед использованием ознакомьтесь с мерами предосторожности.|"страна происхождения: Франция; изготовитель:""Le Parfumeur SAS"", 58 rue Tiquetonne, 75002 Paris, Франция.;"
19000072518|https://goldapple.ru/19000072518-my-nirvana|SIR PARFUMER DNA 2030 MY NIRVANA|9375|RUB|0.0|Пребывая в Индии, создатели пытались впитать часть культуры и философии этой удивительной страны. Религия идет через века собирая вокруг себя множество единомышленников, верующих людей и просто тех, кто ищет себя. Одно из важнейших понятий в индийской религиозной мысли - Нирвана. Это понятие является одним из самых сложных в буддизме: точного определения не дал ему даже сам Будда Шакьямуни. Но создатели, хотели отобразить, что каждый для себя сам должен понять, что же такое «моя нирвана».|нанести на кожу|страна происхождения: Франция;
19000133624|https://goldapple.ru/19000133624-femme-adorable|ANGEL SCHLESSER Femme Adorable|8230|RUB|4.8|Изысканный аромат ANGEL SCHLESSER – символ современной женственности и элегантности. *Главная героиня этой парфюмерной истории – роза с бархатистыми лепестками, которая притягивает красотой и пленяет нежностью. Чистая и чувственная нота переносит во французский город Грас в сезон сбора роз, когда свежие цветы, только собранные руками фермеров, источают неповторимый и яркий аромат. Свежесть бергамота и чарующее звучание цветов яблони делают букет из роз, дополненный жасмином и иланг-илангом, по-настоящему нежным и притягательным. Красоту королевы цветов также обрамляют мягкие гурманские ноты, благодаря которым полностью расцветают женственность и чувственность композиции. *Классификация аромата: цитрусовый розовый цветочный. *Парфюмер – Elise Benat.*|Только для наружного применения.|страна происхождения: Италия; изготовитель:«Angelini Beauty S.p.A.», адрес: Via Melchiorre Gioia, 8, 20124, Milan, Италия.;
19000013011|https://goldapple.ru/19000013011-hundred-silent-ways|NISHANE Hundred Silent Ways|31200|RUB|5.0|Этот аромат был создан, как дань уважения наиболее легендарным ароматам в истории парфюмерии с современной интерпретацией и сочетанием*благородных нот. Чтобы с одной лишь капли аромата можно было чувствовать красоту души, когда-либо порхавшей на земле, и молча разделять*чувства со всеми, с кем она сталкивалась. Будьте готовы к комплиментам. «Я сомкнул губы и говорил с тобой сотней молчаливых способов» - Руми|Наносить на неповрежденные участки кожи. Не распылять вблизи открытого огня. Не допускать попадания в глаза или на поврежденную кожу. Употребление в пищу опасно для здоровья! Хранить в темном месте при комнатной температуре!|страна происхождения: Турция;
