id|url|name|price|currency|rate|description|instruction|made
32110100004|https://goldapple.ru/32110100004-gold-fresh-couture|MOSCHINO Gold Fresh Couture|10990|RUB|4.8|Moschino Gold Fresh Couture - это цветочный древесно-фруктовый аромат. Парфюмерная композиция открывается свежестью фруктовых нот белого персика, мандарина и груши, подчеркнутые зеленым ароматом ревеня. Следом за ними распускается цветочный букет из жасмина, орхидеи и магнолии. **В древесно-пряной базе аромата звучат ноты сандала, каптивного материала акигалавуд (Givaudan), ванили и мускуса. **Необычный флакон духов в форме емкости для чистящего средства окрашен в золотой цвет. Аромат описывается брендом как современная молодежная и роскошная композиция.*СЕМЬЯ АРОМАТА*Цветочная*ГРУППА АРОМАТА*Цветочно-фруктовый*ПИРАМИДА АРОМАТА*Верхняя нота: желтый мандарин, гранита из груши и ревеня, персик с белой мякотью.*Нота сердца: жасмин, ландыш, орхидея.*Ноты базы: сандаловое дерево, перец, пачули, агаровое дерево, ваниль, мускус.||страна происхождения: Италия; изготовитель:«EUROITALIA S.R.L», адрес: Via Galileo Galilei 5, 20873 Cavenago di Brianza (MB), Италия;
19760303657|https://goldapple.ru/19760303657-gentle-fluidity-silver|MAISON FRANCIS KURKDJIAN Gentle Fluidity Silver|14500|RUB|4.9|Свежий, яркий шлейф. Древесный аромат Gentle fluidity Silver, мускатный орех и амбровое дерево доминируют и создают живой, комфортный шлейф. Аккорды семян можжевельника создают пробуждающие, свежие ноты, похожие на аромат «джина со льдом», со сбалансированными сухими, немного бальзамическими, пряными аккордами мускатного ореха. *В нотах сердца проявляются грани амбрового дерева, от сладких и обволакивающих до сильных и сухих.||страна происхождения: Франция; изготовитель:«Parfum Francis Kurkdjian SAS», 41, rue Etienne Marcel, 75001, Paris, Франция;
19000148355|https://goldapple.ru/19000148355-fig-infusion|ESSENTIAL PARFUMS PARIS FIG INFUSION refillable|7372|RUB|4.9|Парфюмер – Nathalie Lorson. «Я представляла себе искрящийся и светлый аромат, посвященный удовольствиям и радостям жизни. Мне хотелось создать композицию, которая вызовет ассоциации с послеобеденным отдыхом в уютном фруктовом саду и сладкой дремой в тени смоковницы».* *Успокаивающая композиция от ESSENTIAL PARFUMS PARIS построена вокруг ноты инжира, объединившей фруктовые, сливочные и зеленые оттенки. Сочность свежего фрукта подчеркивают итальянский мандарин, яркая нота черного чая и апельсиновый цвет. Тёплая нота сандала делает композицию более насыщенной, а бензоин, аромат которого напоминает сочетание ванили, амбры и корицы, придаёт изысканную сладость.**Создатели парфюмерной воды ESSENTIAL PARFUMS PARIS выбирают натуральные, экологически чистые материалы и стремятся снизить воздействие на окружающую среду. Для производства аромата использовались натуральные цветы апельсина из Туниса, бензоин из Вьетнама и черный чай со Шри-Ланки.**Флакон парфюмерной воды подходит для многоразового использования, и его можно пополнять из рефила.|Только для наружного применения.|"страна происхождения: Франция; изготовитель:""ESSENTIAL PARFUMS SAS"", адрес: 107 rue Didot, Villa Jamot 11, 75014 Paris, Франция;"
19000122365|https://goldapple.ru/19000122365-electric-wood|ROOM 1015 ELECTRIC WOOD|13900|RUB|0.0|Гитарный чехол раскрывается, вибрируя, и открывает взгляду «упорядоченный беспорядок»: электрошок лакированной древесины и металлические удары тугих струн, пот перегревшейся, агрессивной древесины. Ночной пепел, облако воздуха, укол прошлого прямо в вену... *«Я никогда не забуду день, когда я первый раз открыл гитарный чехол. Это было в начале девяностых, гитара была марки Gibson. Меня поразил её запах, это была мощная смесь древесины, лака и металла. Я думаю, аромат Electric Wood родился именно в этот день», — Доктор Майк.||страна происхождения: Франция;
19000061654|https://goldapple.ru/19000061654-twice-for-him|ICEBERG TWICE HOMME|1260|RUB|4.8|Туалетная вода ICEBERG TWICE для мужчин – это ароматическая фужерная композиция, в которой гармонично сочетаются освежающие цитрусы и согревающие специи. Искрящиеся верхние ноты лимона и юдзу украшает бодрящая мята. В сердце аромата пряные корица и тмин встречаются с яркими нотами лаванды, гвоздики, эстрагона и герани. Лёгкая кислинка лайма дополняет базовые ноты, среди которых – теплый сандал, пачули, чувственные мускус и амбра, ветивер и чарующая ваниль.*Парфюмер – Ilias Ermenidis.|только для наружного применения|"страна происхождения: Италия; изготовитель:""GIVE BACK BEAUTY S.R.L"", адрес: Corso Italia 13 - 20122 Milano (MI), Италия;"
19000118580|https://goldapple.ru/19000118580-grecale|CHIARA FIRENZE GRECALE|3364|RUB|0.0|Chiara Firenze посвящает свои ароматы в особый регион: Тоскана. история совершенства, страсти и связи с территорией, а также диалога между знаниями и далекими культурами. парфюмерное искусство и выбор ценных эфирных масел, таким образом, встречает мастеров флорентийских ремесленных мастерских, чтобы возродить магию этой особой земли в ваших комнатах. Аромат получил свое название от ветра Грегаля, дующего с северо-востока и несущего корабли из Греции. Это холодный и сухой ветер, который отличается большей интенсивностью и сильными порывами. Ощущение античности приносят сочетания нот дерева гибискуса и перца, усиленные эссенцией гвоздики, корицы и мускатного ореха.||страна происхождения: Италия;
