id|url|name|price|currency|rate|description|instruction|made
83810100013|https://goldapple.ru/83810100013-plush|MIN NEW YORK PLUSH|14336|RUB|5.0|Ваниль, жасмин, ирис и апельсиновый цвет аккуратно собраны в букет, украшенный роскошным мускусом и серой амброй. Композицию дополняют миндаль и гвоздика, а гальбанум усиливает металлические грани яркого, притягательного и наполненного энергией аромата MiN NEW YORK Plush.**||"страна происхождения: Франция; изготовитель:""Grey Matter Holdings Inc."", адрес: 3411 Silverside Road, Tatnall Building# 104, Wilmington, DE 19810, Соединенные Штаты Америки.;"
19000277681|https://goldapple.ru/19000277681-grand-soir|MAISON FRANCIS KURKDJIAN Grand Soir|14500|RUB|5.0|Город Огней, теплый, сияющий и романтичный. Вы надеваете роскошный вечерний наряд, готовясь  открыть для себя богатство великолепного Парижского вечера. Небо усыпано миллионами звезд, воздух пронизан затянувшимся ощущением таинственности. Чарующий, соблазнительный и непреодолимо экстравагантный. В то время как Petit Matin вдохновлен ощущением утра, Grand Soir обещает ночь, которую вы никогда не забудете.|Нанести аромат на запястья, шею и точки пульса.|страна происхождения: Франция; изготовитель:Maison Francis Kurkdjian;
19000127067|https://goldapple.ru/19000127067-change-the-flow|ICEBERG CHANGE THE FLOW|1260|RUB|4.6|Туалетная вода CHANGE THE FLOW от ICEBERG – это смелый мужской аромат для бунтарей и для тех, кто готов нарушать принятые правила и устанавливать свои собственные. Композиция переливается от свежих и пряных верхних нот горького апельсина, шафрана и имбиря к насыщенной землисто-древесной базе, объединившей сандал, кедр и амбру. Чувственный и дерзкий характер аромата ярко выражен в его сердце, где громко заявляют о себе кожаный аккорд и нота табачных листьев. Этот свежий и бодрящий аромат воспевает поток перемен и подходит для тех, кто хочет жить полной жизнью.*|только для наружного применения|"страна происхождения: Италия; изготовитель:""GIVE BACK BEAUTY S.R.L"", адрес: Corso Italia 13 - 20122 Milano (MI), Италия;"
28320100010|https://goldapple.ru/28320100010-moonlight|THE WOODS COLLECTION MOONLIGHT|6350|RUB|2.0|Полная луна возвышается над лесом. Поднимается ветер, облака плывут в тёмном небе. *Лунный свет, сияющий и теплый, как ваниль и амбра, становится всё ярче и пробивается сквозь ветки. В загадочном древесном аромате леса ощущаются сандал, пачули и ладан. *Свет опускается от верхушек деревьев к земле и озаряет герань и розу, выделяя красоту этих нот. *||"изготовитель:""Extravaganza General Trading LLC"", адрес: P3 The Box Storage, Dubai Investment Park 1, Dubai, Объединенные Арабские Эмираты.;"
19000184199|https://goldapple.ru/19000184199-no1|EUTOPIE №1|15900|RUB|0.0|Аромат, гармонично сочетающий в себе, цветочную элегантность и арабские мотивы. Путешествие начинается с цветочной ноты жасмина и розы с прикосновением аниса. Далее идёт погружение в ноты сандалового дерева, кедра и табака. И ф финале раскрываются пудровые ноты амбры и мускуса.|Распылите на расстоянии примерно 20 см. от кожи, уделив особое внимание таким зонам, как запястья и шея.|страна происхождения: Франция; изготовитель:DISTIMEX SAS, 69 rue de la Cavée, 59730 Solesmes, Франция;
19000052224|https://goldapple.ru/19000052224-white-chocola|RICHARD MAISON DE PARFUM White chocola|12900|RUB|4.9|White Chocola от Richar- это настоящие удовольствие для любителей шоколада! Погружение в сладкую бездну, наслаждение легким вкусом пряностей и тонким ароматом сладкой ванили.  Необычное сочетание будет удивлять своим настроением. *Сладкие ноты белого шоколада вместе с теплотой ванили, делают аромат поистине воздушным, довершают этот коктейль цветочные и фруктовые аккорды.*||страна происхождения: ОАЭ;
7430600002|https://goldapple.ru/7430600002-bright-crystal|VERSACE Bright Crystal|9560|RUB|4.9|Всепоглощающая страсть, кристальная прозрачность, яркое великолепие. *Манящий и роскошный аромат для женщины Versace, сильной и уверенной, и в то же время очень женственной и чувственной, и всегда эффектной. Для женщины, которой понравится окутывающая дымка аромата с деликатными нотками яркого и сочного граната, ледяной свежести и сверкающего юзу. В сердце аромата непревзойденный по чистоте и роскоши звучания аккорд магнолии, пиона и цветов лотоса, а в шлейфе — утонченная чувственность и притягательная сила амбры, красного дерева и мускуса. Аромат заключён в элегантный флакон и увенчан великолепной крышкой, ограненной как бриллиант||страна происхождения: Италия; изготовитель:«EUROITALIA S.R.L», адрес: Via Galileo Galilei 5, 20873 Cavenago di Brianza (MB), Италия;
19000059014|https://goldapple.ru/19000059014-radiant-beauty|O-REN AROMA RADIANT BEAUTY|1680|RUB|0.0|Удивительно гармоничная композиция тонких и насыщенных нот цветов и фруктов. Душистая магнолия и звонкий грейпфрут, яркий и свежий запах огурца, цветы ландыша и нежная  фиалка, сочное зеленое яблоко.  Натуральные ротанговые палочки насыщают комнату лёгким невесомым ароматом, настоящие морские ракушки во флаконе аромадиффузора подчеркивают всю многогранность композиции. В состав парфюма для дома O-REN AROMA входят только натуральные масла, они улучшат ваше настроение и придадут сил.  Флаконы большие, 150 мл, и будут радовать Вас минимум 6 месяцев, просто поставьте ароматический диффузор с палочками в место с хорошей циркуляцией воздуха. Диффузор для дома O-REN AROMA впишется в интерьер любого помещения, и станет его идеальным дополнением!|Удалить крышку с флакона, вставить ротанговые палочки. Периодически переворачивать прямые палочки.|страна происхождения: Россия;
19000015894|https://goldapple.ru/19000015894-so-scandal|JEAN PAUL GAULTIER so scandal|7790|RUB|4.8|Новая глава скандальной истории. Флакон получил переливающиеся грани и более насыщенный ягодно-розовый цвет. **Это новый скандал, и все разговоры только о ней, благодаря ее новому аромату: жасмин и молоко – ароматический микс достойный царицы Клеопатры, сочетание малины с ванилью настолько аппетитное! *Аромат невероятно чувственный и манящий, его обладательницу невозможно не заметить.**Как и все ароматы бренда флакон упакован в жестяную банку, уже ставшую символом парфюмерии Jean Paul Gaultier.**Парфюмеры: Дафна Бюже, Фабрис Пеллегрен*||"страна происхождения: Франция; изготовитель: ""Antonio Puig S.A"", адрес: Plaza Europa 46, 08902 Barcelona, Spain, Испания.;"
83670200010|https://goldapple.ru/83670200010-voluptuous-seduction|STATE OF MIND Voluptuous seduction|12410|RUB|0.0|В состав набора входит парфюмерная вода 20 мл в футляре + рефилл 20 мл. Роскошный цветочный аромат Voluptuous Seduction – это уникальный и щедрый букет благородных нот. Он собран из тёплого сочетания ройбуша и лилии, богатства розы и шиповника, необычной гармонии трюфелей и древесных базовых нот сандала и кедра, которые усиливают глубокий чарующий шлейф. Лучезарный, эмоциональный, чувственный аромат намекает на утонченное соблазнение, наделяющее властью. **Верхние ноты: ройбуш, яблоко**Ноты сердца: роза, шиповник, лилия**Базовые ноты: сандал, кедр**||страна происхождения: Франция; изготовитель:ALEGRIA SAS, 36, rue des Fontaines, 92310 Sèvres, Франция;
19000015732|https://goldapple.ru/19000015732-yucatan-secret|COMPTOIR SUD PACIFIQUE YUCATAN SECRET|15120|RUB|0.0|Comptoir Sud Pacifique нашел вдохновение для аромата Yucatan Secret на полуострове Юкатан с его великолепными природными пейзажами, где джунгли хранят, как хорошо хранимый секрет, «сеноты» и их кристально голубые воды.*Секрет Юкатана - это ольфакторная история двойственности между Водой и Землей; кристаллические и водные грани сочетаются, никогда не сталкиваясь, с древесными и амбровыми нюансами, чтобы создать настоящую музыкальную симфонию с ритмом без диссонанса! Бергамот в верхних нотах становится нежным и сладковатым от арбуза, затем лаванда, поддерживаемая гранями абсента, играет трели, переходя к роскошному шлейфу из древесных и амбровых аккордов.*Тома Фонтэн, создатель этого творения, прекрасно справляется с устранением всех уголков, и нахождением идеальной гармонии ингредиентов между Водой и Землей, женским и мужским. **||страна происхождения: Франция;
19000206601|https://goldapple.ru/19000206601-nights-in-noto|BIRKHOLZ Nights in Noto|20769|RUB|0.0|Гипнотический аромат BIRKHOLZ посвящен теплым ночам в итальянском городе Ното. Таинственные силуэты, магический лунный свет и изумрудные огни ночного города – всё это создает уникальное мечтательное настроение, отражённое в гармонии пряных и цветочных нот. *Чарующее звучание розы в сочетании с теплым шафраном и нежным сандалом побуждает уйти от реальности и погрузиться в сладость момента.|Только для наружного применения.|"страна происхождения: Германия; изготовитель:""BIRKHOLZ International GmbH"", мекенжай: Albert-Einstein-Ring 46, 14532 Kleinmachnow, Германия.;"
19760310030|https://goldapple.ru/19760310030-sense-of-humor|STATE OF MIND Sense of Humor|7175|RUB|0.0|Зеленый цитрусовый аромат Sense of Humor – это эйфорическое сочетание яркости и экзотики. Игривое и весёлое зелье открывается неожиданными нотами мате и чая Дарджилинг в сочетании с листьями чёрной смородины и кинзы. Аромат переходит в свежую гармонию солнечного цитрона, мандарина и персика, дополненную тёплыми нотами кедра и мускуса. Насыщенная и бодрящая композиция намекает: юмор – это лучшая одежда, которую нужно носить в обществе. **Верхние ноты: персик, листья чёрной смородины, мускус**Ноты сердца: чай Дарджилинг, цитрон, мате**Базовые ноты: мандарин, кориандр, кедр**||страна происхождения: Франция; изготовитель:ALEGRIA SAS, 36, rue des Fontaines, 92310 Sèvres, Франция;
26801500004|https://goldapple.ru/26801500004-baccarat-rouge-540|MAISON FRANCIS KURKDJIAN Baccarat Rouge 540|10000|RUB|3.6|Парфюмированная дымка для волос Baccarat Rouge 540 деликатно покрывает волосы нежным ароматом, делая волосы мягкими благодаря своей легкой, воздушной текстуре. Дымка не утяжеляет волосы, придает ощущение свежести.*Яркая ольфакторная подпись. Baccarat Rouge 540 окутывает кожу амбровой, цветочно-древесной вуалью.*Воздушные ноты жасмина и сияющего шафрана сочетаются с минеральными оттенками амбры и древесными аккордами свежесрубленного кедра.   *Парфюмированная дымка Baccarat Rouge 540 на основе касторового масла заключена в иконический стеклянный флакон Дома. Исключительный ольфакторный ритуал для ежедневного удовольствия.*Чтобы насладиться моментом ухода за собой и продлить звучание вашего аромата Baccarat Rouge 540, попробуйте также парфюмированное масло для тела Baccarat Rouge 540.||
19000002873|https://goldapple.ru/19000002873-resort-lovers|MANDARINA DUCK RESORT LOVERS|4350|RUB|4.7|Аромат RESORT LOVERS подходит тем, кто любит расслабляющие путешествия и отдых с максимальным комфортом. Закрыть глаза, забыть обо всем и представить себя на экзотическом спа-курорте помогут верхние ноты бергамота и листьев фиалки, а также свежий акватический аккорд. Наслаждение моментом продлевают ноты розы, ландыша и османтуса, формирующие гармонию в сердце аромата MANDARINA DUCK. Все заботы исчезают – остаются лишь море, природа и умиротворяющие базовые ноты нагармоты, бобов тонка и пачули. Семейство аромата: мускусный, цветочный, акватический. *||страна происхождения: Испания; изготовитель:«Angelini Beauty S.p.A.», адрес: Via Melchiorre Gioia, 8, 20124, Milan, Италия;
7200700004|https://goldapple.ru/7200700004-the-one-for-men|DOLCE & GABBANA THE ONE FOR MEN|6230|RUB|5.0|Туалетная вода Dolce&Gabbana The One for Men это чувственный и элегантный аромат, определенно принадлежащий современности – и в то же время в нем слышна уникальная, неподвластная времени классика. *Ориентальный пряный аромат, рождающийся в гармонии табака и утонченных специй.*Вибрирующая элегантность верхних нот происходит из аппетитного сочетания грейпфрута, кориандра и базилика. Пряные и теплые ноты кардамона и имбиря составляют основу чувственного сердца мужского аромата Dolce&Gabbana The One for Men. С течением времени раскрывается подлинная мужественная сущность этого аромата, звучащая аккордами табака, амбры и теплого кедра. *||страна происхождения: Франция;
19000196094|https://goldapple.ru/19000196094-peonia-in-fiore|LOGEVY FIRENZE 1965 Peonia in Fiore|11390|RUB|0.0|Нежный цветок с неповторимым оттенком и ароматом. Пион известен как горная роза, имеет сладкий, насыщенный, терпкий аромат. Самый нежный, романтичный аромат в нашей линейке *Пионы здесь не сладкие, они лёгкие и свежие. Наполнят ваше пространство нежностью, свежестью и чистотой, словно капли дождя на пионах.*|Ароматы лучше расположить в центральной части дома так, чтобы любой входящий или выходящий из дома мог уловить аромат и перенести его в остальные комнаты. Для поддержания аромата переворачивайте палочки через день. Регулировать аромат можно уменьшая или увеличивая число палочек. Палочки играют основную роль в ароматизации помещения, чем больше палочек, тем аромат насыщеннее. Для достижения лучших результатов, эссенцию не стоит никогда выставлять на прямой солнечный свет или ставить рядом с источниками тепла, так как под его воздействием происходит испарение аромата.|"страна происхождения: Италия; изготовитель:LOGEVY FIRENZE 1965| Via PIPPO SPANO 8 50129 - FIRENZE- Italy;"
7291400001|https://goldapple.ru/7291400001-lady-million|PACO RABANNE Lady Million|5505|RUB|4.9|Парфюмерная вода Paco Rabanne Lady Million обладает густым и стойким ароматом. В нем сочетаются сладость малины и меда, экзотичность нероли и амальфитанского лимона, терпкость амбры и насыщенность жасмина. Шлейф этой парфюмерной воды обволакивающий, чарующий. Он ассоциируется с роскошной и красивой жизнью. Женщины, пользующиеся парфюмом Lady Million, воспринимаются окружающими блистательными, немного экстравагантными, томными. Эта вода как огранка дорогостоящего бриллианта. Такая же великолепная, сияющая. Парфюмом от Paco Rabanne можно пользоваться круглый год. Претенциозность его аромата сохраняется в жару и холод.||"страна происхождения: Франция; изготовитель: ""Antonio Puig S.A"", Адрес: Plaza Europa 46, 08902 Barcelona, Spain, Испания.;"
19000110366|https://goldapple.ru/19000110366-tobacco-volute|L'ATELIER PARFUM TOBACCO VOLUTE|7002|RUB|5.0|Притягательный аромат L’ATELIER PARFUM окружает завораживающей дымкой с нотами табака, смягченными чувственной, сладкой ванилью и бобами тонка, которые делают композицию сбалансированной и добавляют легкий оттенок миндаля. Парфюмерная вода TOBACCO VOLUTE, напоминающая о моментах, посвященных человеком самому себе, и о маленьких удовольствиях, воплощает аромат деревянной коробки с лучшими сигарами, в которых помимо насыщенных табачных листьев ощущаются медовые ноты, теплый аккорд пшеницы и сена, а также лёгкая сладость. Ключевые ноты: табак, ваниль, бобы тонка. Парфюмер - ALEXIS DADIER.|только для наружного применения.|страна происхождения: Франция; изготовитель:«L’Atelier Parfum Paris SAS», адрес: 142 rue du Président Willson, 92300 Levallois-Perret, Франция.;
19000172316|https://goldapple.ru/19000172316-invictus-victory-elixir|PACO RABANNE Invictus Victory ELIXIR|13850|RUB|5.0|Квинтэссенция насыщенности во вселенной Invictus от Paco Rabanne.*Обновленный манифест о воле к безграничным достижениям. Пришло время*запечатлеть момент и ощутить себя в лучах славы с Invictus Victory Elixir, новым*эффектным ароматом для мужчин. Пора насладиться моментом истинного*величия.       Многогранная, яркая, стойкая композиция сочетает в себе пряные древесные*аккорды и обжигающую свежесть, являя собой новое интенсивное воплощение*культового аромата Paco Rabanne. Никогда не останавливайся на достигнутом с Invictus Victory Elixir от Paco*Rabanne.|Нанести на кожу, избегая попадания в глаза.|страна происхождения: Франция; изготовитель:«Puig France SAS», ФРАНЦИЯ, 65/67, Avenue des Champs Elysees, 75008, Paris, France;
