id|url|name|price|currency|rate|description|instruction|made
19000257108|https://goldapple.ru/19000257108-80-latitudinal|SARANGHAEYO 80. Latitudinal|17100|RUB|0.0|Аромат SARANGHAEYO посвящен динамичной атмосфере Шанхая с его оживленными перекрестками и людными улицами, мигающими светофорами и яркими огнями. Энергию города передает дуэт иланг-иланга и черного перца. *Парфюмерная композиция с выраженным звучанием амбры рассказывает историю о запретной, противоречивой любви в этом интригующем городе. Цветочные ноты отражают романтичность, а острые и пряные акценты символизирует интеллигентную сдержанность и скрытые чувства.|Только для наружного применения.|страна происхождения: Республика Корея; 
19000150172|https://goldapple.ru/19000150172-demain-promis|BASTILLE Demain Promis|9682|RUB|5.0|День для себя – это любимая книга, просмотр сериала, теплая ванна и парфюмерная вода DEMAIN PROMIS. Окутывающая ароматическая композиция – словно эликсир расслабления во флаконе. *Кажущийся знакомым и близким, но при этом чувственный аромат идеально подходит для беззаботных моментов отдыха. Приятная гармония нежных молочных нот, шалфея, розы, кардамона, сладких бобов тонка и кремового звучания сандала помогает отвлечься от всех забот, отложить дела и посвятить время себе. *Французская парфюмерная вода BASTILLE создана на основе натуральных компонентов. *Парфюмер – Caroline Dumur.|Для наружного применения.|"страна происхождения: Франция; изготовитель:""ESTER SAS"", адрес: 5 AVENUE DU GEN DE GAULLE, 94160 SAINT-MANDE, Франция; "
19000118616|https://goldapple.ru/19000118616-urtica|CHIARA FIRENZE URTICA|3102|RUB|0.0|Chiara Firenze посвящает свои ароматы в особый регион: Тоскана. история совершенства, страсти и связи с территорией, а также диалога между знаниями и далекими культурами. парфюмерное искусство и выбор ценных эфирных масел, таким образом, встречает мастеров флорентийских ремесленных мастерских, чтобы возродить магию этой особой земли в ваших комнатах.||страна происхождения: Италия; 
19000061647|https://goldapple.ru/19000061647-effusion-for-her|ICEBERG EFFUSION WOMAN|1260|RUB|4.6|Многогранный женский аромат ICEBERG стартует с яркой и бодрящей ноты грейпфрута, смягченной фруктовой свежестью киви и маракуйи. Плавно рассеиваясь, фруктовое облако уступает место чувственному мускатному ореху и кардамону, который придает аромату лёгкую остроту.*Пряные ноты переплетаются с цветочной элегантностью фрезии, жасмина, фиалки и розы, делая композицию одновременно свежей, нежной и терпкой.Теплые базовые ноты кедра, сандала, чарующего мускуса и сладкой ванили усиливают чувственность аромата и подчеркивают его уникальный характер.|только для наружного применения|"страна происхождения: Италия; изготовитель:""GIVE BACK BEAUTY S.R.L"", адрес: Corso Italia 13 - 20122 Milano (MI), Италия; "
19000244395|https://goldapple.ru/19000244395-42-sm-krasnyj-2-stuki|ALDE CANDLES 42 см красный, 2 штуки|450|RUB|0.0|Свеча коническая 42 см , 2 шт в упаковке, Оттенок: №24 красный. Вес упаковки 190 гр. Размер упаковки: 43*5*2,5.||страна происхождения: Россия; изготовитель:ИП Молчанов Р.С. Юридический адрес улица Ю.Иванова, д. 88, Псковская область, р-н Дедовичский, рабочий поселок Дедовичи. Почта aldecandles@yandex.ru . +79117378880; Продавец; ИП Молчанов Роман Сергеевич; ОГРН / ОГРНИП; 317602700029301; Юридический адрес; Псковская обл., р-н Дедовичский, рабочий поселок Дедовичи, ул.Ю.Иванова, д. 88; 
19000035831|https://goldapple.ru/19000035831-regent-leather|THAMEEN LONDON Regent Leather|31200|RUB|0.0|Путешествие в Париж необходимо предпринять хотя бы для того, чтобы увидеть своими глазами Алмаз Регента – практически безупречного камня, который хранится сейчас в Лувре. Если путешествие в планы не входит, попробуйте аромат Regent Leather от Thameen – он открывается цитрусовым аккордом лимона, на смену которому приходят цветочно-пряные ноты и древесные акценты кедра. 141 карат Алмаза Регента – в 50-миллилитровом флаконе Thameen.|Нанести на пульсирующие точки - и ждать комплиментов.|страна происхождения: Великобритания; 
19000138444|https://goldapple.ru/19000138444-james|ATKINSONS James|15525|RUB|4.8|Atkinsons представляет новую парфюмерную воду James. James – это дань уважения приверженности Джеймса Аткинсона абсолютному качеству. Богатый, состоящий из самых благородных ингредиентов высокой парфюмерии, этот аромат мастерски сочетает в себе древесно-амбровые ноты с пряными оттенками. Современный парфюм, в котором взрывное свежее начало уступает тёплому амброво-цветочному сердцу, оттеняя изысканный древесный шлейф с элегантным звучанием ветивера и пачули.||страна происхождения: Италия; изготовитель:«EUROITALIA S.R.L», адрес: Via Galileo Galilei 5, 20873 Cavenago di Brianza (MB), Италия;
